{
  "$schema": "./blueprint.schema.json",
  "blueprintVersion": 1,
  "generatedFrom": [
    "todo-task-000-split.md §3, §4, §4.1",
    "02-database-architecture.md §2, §6.1",
    "04-frontend-folder-architecture.md §4, §5.2",
    "03-frontend-architecture.md §11",
    "01-thinkboard-lite-spec.md §4.3"
  ],
  "contexts": [
    {
      "name": "entities",
      "kind": "kernel",
      "path": "src/features/entities",
      "owns": "the Dexie mirror: db, repository (writes), queries (reads)"
    },
    {
      "name": "sync",
      "kind": "kernel",
      "path": "src/features/sync",
      "owns": "outbox push, realtime pull, reconcile"
    },
    {
      "name": "workspace",
      "kind": "context",
      "path": "src/features/workspace",
      "owns": "auth guard, create, members, leader, personas, goal, the shell"
    },
    {
      "name": "document",
      "kind": "context",
      "path": "src/features/document",
      "owns": "PDF load, page windowing, viewport"
    },
    {
      "name": "highlight",
      "kind": "context",
      "path": "src/features/highlight",
      "owns": "capture, layers, promotion, import"
    },
    {
      "name": "notes",
      "kind": "context",
      "path": "src/features/notes",
      "owns": "individual and group notes, handwriting"
    },
    {
      "name": "result",
      "kind": "context",
      "path": "src/features/result",
      "owns": "runs, temperature, renderings"
    },
    {
      "name": "presence",
      "kind": "context",
      "path": "src/features/presence",
      "owns": "who is here, cursors — ref-based, no store"
    }
  ],
  "domainTables": [
    {
      "name": "profiles",
      "cluster": "identity",
      "lite": "active",
      "dexie": "meta"
    },
    {
      "name": "profile_identities",
      "cluster": "identity",
      "lite": "active",
      "dexie": "meta"
    },
    {
      "name": "teams",
      "cluster": "identity",
      "lite": "active",
      "dexie": "meta"
    },
    {
      "name": "team_members",
      "cluster": "identity",
      "lite": "active",
      "dexie": "meta"
    },
    {
      "name": "persona_disciplines",
      "cluster": "personas",
      "lite": "read-only",
      "dexie": null
    },
    {
      "name": "user_personas",
      "cluster": "personas",
      "lite": "active",
      "dexie": "meta"
    },
    {
      "name": "team_personas",
      "cluster": "personas",
      "lite": "active",
      "dexie": "meta"
    },
    {
      "name": "boards",
      "cluster": "workspace",
      "lite": "active",
      "dexie": null
    },
    {
      "name": "board_columns",
      "cluster": "workspace",
      "lite": "active",
      "dexie": null
    },
    {
      "name": "sessions",
      "cluster": "workspace",
      "lite": "active",
      "dexie": "meta"
    },
    {
      "name": "messages",
      "cluster": "workspace",
      "lite": "parked",
      "dexie": null
    },
    {
      "name": "context_warnings",
      "cluster": "workspace",
      "lite": "parked",
      "dexie": null
    },
    {
      "name": "artifacts",
      "cluster": "document",
      "lite": "active",
      "dexie": "artifacts"
    },
    {
      "name": "highlights",
      "cluster": "document",
      "lite": "active",
      "dexie": "highlights"
    },
    {
      "name": "highlight_notes",
      "cluster": "document",
      "lite": "active",
      "dexie": "notes"
    },
    {
      "name": "mini_conclusions",
      "cluster": "document",
      "lite": "active",
      "dexie": "miniConclusions"
    },
    {
      "name": "highlight_term_weights",
      "cluster": "document",
      "lite": "active",
      "dexie": null
    },
    {
      "name": "memory_entries",
      "cluster": "memory",
      "lite": "active",
      "dexie": "meta"
    },
    {
      "name": "pipeline_runs",
      "cluster": "pipeline",
      "lite": "active",
      "dexie": "runs"
    },
    {
      "name": "pipeline_stages",
      "cluster": "pipeline",
      "lite": "active",
      "dexie": null
    },
    {
      "name": "points",
      "cluster": "pipeline",
      "lite": "active",
      "dexie": "runs"
    },
    {
      "name": "point_conclusions",
      "cluster": "pipeline",
      "lite": "active",
      "dexie": "runs"
    },
    {
      "name": "run_renderings",
      "cluster": "pipeline",
      "lite": "active",
      "dexie": "runs"
    },
    {
      "name": "sources",
      "cluster": "sources",
      "lite": "parked",
      "dexie": null
    },
    {
      "name": "point_sources",
      "cluster": "sources",
      "lite": "parked",
      "dexie": null
    },
    {
      "name": "llm_providers",
      "cluster": "llm",
      "lite": "read-only",
      "dexie": "meta"
    },
    {
      "name": "llm_models",
      "cluster": "llm",
      "lite": "read-only",
      "dexie": "meta"
    },
    {
      "name": "user_llm_keys",
      "cluster": "llm",
      "lite": "active",
      "dexie": "meta"
    },
    {
      "name": "llm_requests",
      "cluster": "llm",
      "lite": "active",
      "dexie": "meta"
    }
  ],
  "localFirst": {
    "db": "src/features/entities/db/thinkboard-db.ts",
    "dbName": "thinkboard:{profileId}",
    "dexieVersion": 1,
    "idStrategy": "uuidv7-client",
    "blobStore": "opfs",
    "tables": [
      {
        "name": "meta",
        "schema": "key",
        "mirrors": [
          "profiles",
          "profile_identities",
          "teams",
          "team_members",
          "user_personas",
          "team_personas",
          "sessions",
          "memory_entries",
          "llm_providers",
          "llm_models",
          "user_llm_keys",
          "llm_requests"
        ],
        "localOnly": false
      },
      {
        "name": "artifacts",
        "schema": "id, sessionId",
        "mirrors": [
          "artifacts"
        ],
        "localOnly": false
      },
      {
        "name": "highlights",
        "schema": "id, [artifactId+page], layer, _sync",
        "mirrors": [
          "highlights"
        ],
        "localOnly": false
      },
      {
        "name": "notes",
        "schema": "id, highlightId, profileId, _sync",
        "mirrors": [
          "highlight_notes"
        ],
        "localOnly": false
      },
      {
        "name": "miniConclusions",
        "schema": "highlightId",
        "mirrors": [
          "mini_conclusions"
        ],
        "localOnly": false
      },
      {
        "name": "runs",
        "schema": "id, sessionId, ownerProfileId",
        "mirrors": [
          "pipeline_runs",
          "points",
          "point_conclusions",
          "run_renderings"
        ],
        "localOnly": false
      },
      {
        "name": "outbox",
        "schema": "++seq, rowId, table, state",
        "mirrors": [],
        "localOnly": true
      }
    ],
    "rowFlag": {
      "field": "_sync",
      "values": [
        "clean",
        "pending",
        "failed"
      ]
    },
    "outbox": {
      "table": "outbox",
      "ops": [
        "insert",
        "update",
        "delete",
        "rpc"
      ],
      "rpcFns": [
        "promote_highlight"
      ],
      "states": [
        "queued",
        "failed"
      ],
      "fields": [
        "seq",
        "rowId",
        "table",
        "op",
        "fn",
        "payload",
        "state",
        "attempts",
        "lastError"
      ]
    },
    "localOnlyFields": [
      "_sync",
      "seq",
      "state"
    ],
    "wireNames": {
      "notes": "highlight_notes"
    },
    "localStorageKeys": [
      "supabase-session",
      "theme",
      "last-workspace-id",
      "mode"
    ]
  },
  "commands": [
    {
      "name": "create-workspace",
      "method": "POST",
      "baseUrl": "/api",
      "url": "/v1/workspaces",
      "route": "src/app/api/v1/workspaces/route.ts",
      "returns": "id"
    },
    {
      "name": "mini-conclusion",
      "method": "POST",
      "baseUrl": "/api",
      "url": "/v1/highlights/:id/mini-conclusion",
      "route": "src/app/api/v1/highlights/[id]/mini-conclusion/route.ts",
      "returns": "status"
    },
    {
      "name": "generate-result",
      "method": "POST",
      "baseUrl": "/api",
      "url": "/v1/workspaces/:id/results",
      "route": "src/app/api/v1/workspaces/[id]/results/route.ts",
      "returns": "id"
    },
    {
      "name": "run-stream",
      "method": "GET",
      "baseUrl": "/api",
      "url": "/v1/runs/:id/stream",
      "route": "src/app/api/v1/runs/[id]/stream/route.ts",
      "returns": "sse"
    }
  ],
  "canvasLeaves": [
    {
      "name": "page-stage",
      "layer": "z2-host",
      "hasPainter": false,
      "status": "active"
    },
    {
      "name": "highlight-layer",
      "layer": "z2",
      "hasPainter": true,
      "status": "active"
    },
    {
      "name": "ink-pad",
      "layer": "modal",
      "hasPainter": true,
      "status": "conditional",
      "gatedBy": "024"
    },
    {
      "name": "peer-cursors",
      "layer": "z2",
      "hasPainter": true,
      "status": "active"
    },
    {
      "name": "marquee",
      "layer": "z2",
      "hasPainter": true,
      "status": "active"
    }
  ],
  "listeners": [
    {
      "context": "sync",
      "on": [
        "workspaceOpened",
        "outboxQueued",
        "modeChanged",
        "remoteChangeReceived"
      ]
    }
  ],
  "invariants": [
    {
      "id": "I1",
      "rule": "Every component folder has an index.ts",
      "enforcedBy": "script",
      "enforcement": "script",
      "specifiedIn": "ffa §12.1",
      "note": "filesystem walk"
    },
    {
      "id": "I2",
      "rule": "No hooks in a .tsx with a sibling use-.ts",
      "enforcedBy": "script",
      "enforcement": "script",
      "specifiedIn": "ffa §12.2",
      "note": "the UI/logic seam"
    },
    {
      "id": "I3",
      "rule": "shared/ never imports @feature/ or @app/",
      "enforcedBy": "eslint",
      "enforcement": "eslint",
      "specifiedIn": "ffa §12.3",